{
  "name": "test-api",
  "version": "1.0.0",
  "desc": "接口测试执行：检查接口测试计划并执行（req/resp 断言与调通），产出接口测试报告",
  "phases": [
    {
      "id": "01",
      "summary": "执行接口测试计划并产出报告",
      "type": "action",
      "output": "api-test-report.md"
    }
  ],
  "defaults": {
    "extra_ctx": "",
    "rules": [
      "按计划执行，不越层（页面/客户端端到端操作不在本阶段范围）",
      "每项接口必须同时覆盖：req 可发出、resp 符合断言、链路调通",
      "失败项如实记录（含状态码/响应体摘要），不得粉饰为通过"
    ]
  }
}
