{
  "name": "git-worktree",
  "version": "2.2.0",
  "desc": "启动前置动作：冷启动问得 title 后、run start 之前创建 Git 分支与隔离工作树（注册收敛进 state.git，本任务不产出文件）",
  "defaults": {
    "extra_ctx": "",
    "rules": [
      "任何 git 命令失败立即暂停报告，不得带错继续",
      "不得修改 .gitignore 或 git exclude"
    ]
  },
  "configurable": [
    {
      "key": "mode",
      "desc": "worktree 场景：none=不使用（缺省，主检出/当前目录直接启动）/ single=单分支（基线=仓库主分支）/ release-dev=发布+开发（基线=base_branch）",
      "default": "none"
    },
    {
      "key": "base_branch",
      "desc": "release-dev 场景的基线（发布）分支名；single 场景不使用"
    },
    {
      "key": "worktree_dir",
      "desc": "worktree 落盘父目录（绝对路径）；缺省为项目根父目录"
    }
  ]
}
