{
  "name": "test-unit",
  "version": "1.0.0",
  "desc": "单元测试执行：检查单元测试计划并执行（串行每批 1-3 条或并行），产出单元测试报告",
  "phases": [
    {
      "id": "01",
      "summary": "执行单元测试计划并产出报告",
      "type": "action",
      "output": "unit-test-report.md"
    }
  ],
  "defaults": {
    "extra_ctx": "",
    "rules": [
      "按计划执行，不越层（接口/e2e 验证不在本阶段范围）",
      "逐条记录结果：计划中每条用例必须有对应结果行，失败项如实记录不粉饰",
      "串行模式逐批记录（每批 1-3 条）；并行模式汇总记录批次与结果"
    ]
  }
}
