{
  "name": "test-reporting",
  "version": "1.0.0",
  "desc": "测试工作流收尾：聚合范围、计划与各执行层报告，产出测试总结（链尾无条件阶段）",
  "phases": [
    {
      "id": "01",
      "summary": "聚合各层结果并产出测试总结",
      "type": "action",
      "output": "test-reporting.md"
    }
  ],
  "defaults": {
    "extra_ctx": "",
    "rules": [
      "汇总必须基于既有产物（scope/计划/各层报告），不重新执行测试",
      "未启用层级在汇总表中如实标注「未启用」，不编造数据",
      "失败项与遗留项必须逐条可追溯到对应报告"
    ]
  }
}
